{
  "schema": "akbs-client-adapter-outputs-v1",
  "authority": "untrusted_client_input",
  "source_package_key": "20260901/member1/20260901-000000-test",
  "qualification_input_sha256": "071ab71e654d62a7ffe87cfbf752f719d37b897b7df9a67e25457007add0455d",
  "profile_id": "akbs-component-evidence-profiles-v1",
  "profile_artifact_sha256": "5e2f0eb8341d3b6ef58084adcaeebfb6627c83807776b13f1e709fbec847dc4c",
  "declared_package_status": "validated",
  "components": [
    {
      "component_id": "component-1",
      "outputs": [
    {"schema": "akbs-client-adapter-output-v1", "component_id": "component-1", "group_id": "source_integrity", "source_evidence_id": "evidence-1", "source_evidence_sha256": "4444444444444444444444444444444444444444444444444444444444444444", "adapter_contract": "akbs-source-integrity-adapter", "adapter_version": "1", "claim": "source_integrity", "adapter_result": "PASS"},
    {"schema": "akbs-client-adapter-output-v1", "component_id": "component-1", "group_id": "change_diff_facts", "source_evidence_id": "evidence-1", "source_evidence_sha256": "4444444444444444444444444444444444444444444444444444444444444444", "adapter_contract": "akbs-change-diff-adapter", "adapter_version": "1", "claim": "change_diff_facts", "adapter_result": "PASS"},
    {"schema": "akbs-client-adapter-output-v1", "component_id": "component-1", "group_id": "risk_surface", "source_evidence_id": "evidence-1", "source_evidence_sha256": "4444444444444444444444444444444444444444444444444444444444444444", "adapter_contract": "akbs-risk-surface-adapter", "adapter_version": "1", "claim": "risk_surface", "adapter_result": "PASS"},
    {"schema": "akbs-client-adapter-output-v1", "component_id": "component-1", "group_id": "android_change_policy", "source_evidence_id": "evidence-1", "source_evidence_sha256": "4444444444444444444444444444444444444444444444444444444444444444", "adapter_contract": "akbs-android-change-policy-adapter", "adapter_version": "1", "claim": "android_change_policy", "adapter_result": "PASS"},
    {"schema": "akbs-client-adapter-output-v1", "component_id": "component-1", "group_id": "feature_acceptance", "source_evidence_id": "evidence-1", "source_evidence_sha256": "4444444444444444444444444444444444444444444444444444444444444444", "adapter_contract": "akbs-feature-acceptance-adapter", "adapter_version": "1", "claim": "feature_acceptance", "adapter_result": "PASS"},
    {"schema": "akbs-client-adapter-output-v1", "component_id": "component-1", "group_id": "regression", "source_evidence_id": "evidence-1", "source_evidence_sha256": "4444444444444444444444444444444444444444444444444444444444444444", "adapter_contract": "akbs-regression-adapter", "adapter_version": "1", "claim": "regression", "adapter_result": "PASS"},
    {"schema": "akbs-client-adapter-output-v1", "component_id": "component-1", "group_id": "rollback", "source_evidence_id": "evidence-1", "source_evidence_sha256": "4444444444444444444444444444444444444444444444444444444444444444", "adapter_contract": "akbs-rollback-adapter", "adapter_version": "1", "claim": "rollback", "adapter_result": "PASS"},
    {"schema": "akbs-client-adapter-output-v1", "component_id": "component-1", "group_id": "pre_change_search", "source_evidence_id": "evidence-1", "source_evidence_sha256": "4444444444444444444444444444444444444444444444444444444444444444", "adapter_contract": "akbs-pre-change-search-adapter", "adapter_version": "1", "claim": "pre_change_search", "adapter_result": "PASS"},
    {"schema": "akbs-client-adapter-output-v1", "component_id": "component-1", "group_id": "application_build", "source_evidence_id": "evidence-1", "source_evidence_sha256": "4444444444444444444444444444444444444444444444444444444444444444", "adapter_contract": "akbs-application-build-adapter", "adapter_version": "1", "claim": "application_build", "adapter_result": "PASS"},
    {"schema": "akbs-client-adapter-output-v1", "component_id": "component-1", "group_id": "application_runtime_or_integration", "source_evidence_id": "evidence-1", "source_evidence_sha256": "4444444444444444444444444444444444444444444444444444444444444444", "adapter_contract": "akbs-application-runtime-adapter", "adapter_version": "1", "claim": "application_runtime_or_integration", "adapter_result": "PASS"},
    {"schema": "akbs-client-adapter-output-v1", "component_id": "component-1", "group_id": "permission_and_signing", "source_evidence_id": "evidence-1", "source_evidence_sha256": "4444444444444444444444444444444444444444444444444444444444444444", "adapter_contract": "akbs-permission-signing-adapter", "adapter_version": "1", "claim": "permission_and_signing", "adapter_result": "PASS"}
      ]
    }
  ]
}
